{
  "$schema_version": 1,
  "source": {
    "document": "GPSG-1000 Remote Programming Manual",
    "part_number": "22165259 Rev. 501",
    "date": "2022-07",
    "companion": "GPSG-1000 Operation Manual 22165258 Rev. 502 (2023-12)"
  },
  "transport": {
    "protocol": "raw TCP (telnet-compatible)",
    "port": 5025,
    "terminator": "\\n",
    "case_sensitive": false,
    "query_returns_short_form": true,
    "default_units_at_session_start": "SI (per 1.8) or IMPERIAL (per 10.1.52); see D04"
  },
  "conventions": {
    "short_form": "Uppercase letters of the header are the short form; only long or short form accepted.",
    "kinds": {
      "set": "takes parameters",
      "query": "ends with ?",
      "action": "no parameters, not queryable"
    },
    "locked_while_running": "True when the manual states the parameter cannot be changed while a simulation is in progress.",
    "emit_allowed": "False for commands the twin must never generate (calibration, password, *RST).",
    "verified_on_hw": "Set to True only after confirmation on the physical unit, with session id in notes."
  },
  "commands": [
    {
      "header": "*CLS",
      "kind": "action",
      "aliases": [],
      "params": [],
      "query_params": [],
      "returns": null,
      "example": null,
      "locked_while_running": null,
      "category": "common",
      "manual_page": "2-1",
      "notes": "Clears status registers and error queue.",
      "discrepancies": [],
      "emit_allowed": true,
      "verified_on_hw": false
    },
    {
      "header": "*ESE",
      "kind": "set",
      "aliases": [],
      "params": [
        {
          "name": "mask",
          "type": "int",
          "min": 0,
          "max": 255
        }
      ],
      "query_params": [],
      "returns": null,
      "example": null,
      "locked_while_running": null,
      "category": "common",
      "manual_page": "2-1",
      "notes": null,
      "discrepancies": [],
      "emit_allowed": true,
      "verified_on_hw": false
    },
    {
      "header": "*ESE?",
      "kind": "query",
      "aliases": [],
      "params": [],
      "query_params": [],
      "returns": {
        "type": "int",
        "range": [
          0,
          255
        ]
      },
      "example": null,
      "locked_while_running": null,
      "category": "common",
      "manual_page": "2-2",
      "notes": null,
      "discrepancies": [],
      "emit_allowed": true,
      "verified_on_hw": false
    },
    {
      "header": "*ESR?",
      "kind": "query",
      "aliases": [],
      "params": [],
      "query_params": [],
      "returns": {
        "type": "int",
        "range": [
          0,
          255
        ]
      },
      "example": null,
      "locked_while_running": null,
      "category": "common",
      "manual_page": "2-2",
      "notes": null,
      "discrepancies": [],
      "emit_allowed": true,
      "verified_on_hw": false
    },
    {
      "header": "*IDN?",
      "kind": "query",
      "aliases": [],
      "params": [],
      "query_params": [],
      "returns": {
        "type": "string",
        "format": "Manufacturer,Model,Serial(10),SwIssue(n.n.n),Placeholder",
        "example": "Aeroflex,GPSG-1000,1000372866,2.0.0,0"
      },
      "example": null,
      "locked_while_running": null,
      "category": "common",
      "manual_page": "2-2",
      "notes": null,
      "discrepancies": [],
      "emit_allowed": true,
      "verified_on_hw": false
    },
    {
      "header": "*OPC",
      "kind": "action",
      "aliases": [],
      "params": [],
      "query_params": [],
      "returns": null,
      "example": null,
      "locked_while_running": null,
      "category": "common",
      "manual_page": "2-3",
      "notes": "No overlapped commands in the instrument; completes immediately.",
      "discrepancies": [],
      "emit_allowed": true,
      "verified_on_hw": false
    },
    {
      "header": "*OPC?",
      "kind": "query",
      "aliases": [],
      "params": [],
      "query_params": [],
      "returns": {
        "type": "int",
        "example": "1"
      },
      "example": null,
      "locked_while_running": null,
      "category": "common",
      "manual_page": "2-3",
      "notes": null,
      "discrepancies": [],
      "emit_allowed": true,
      "verified_on_hw": false
    },
    {
      "header": "*OPT?",
      "kind": "query",
      "aliases": [],
      "params": [],
      "query_params": [],
      "returns": null,
      "example": null,
      "locked_while_running": null,
      "category": "common",
      "manual_page": "1-4",
      "notes": "Listed as not supported.",
      "discrepancies": [],
      "emit_allowed": false,
      "verified_on_hw": false
    },
    {
      "header": "*RST",
      "kind": "action",
      "aliases": [],
      "params": [],
      "query_params": [],
      "returns": null,
      "example": null,
      "locked_while_running": null,
      "category": "common",
      "manual_page": "2-3",
      "notes": "Resets to power-on default state. Destroys the current setup of a shared unit.",
      "discrepancies": [],
      "emit_allowed": false,
      "verified_on_hw": false
    },
    {
      "header": "*SRE",
      "kind": "set",
      "aliases": [],
      "params": [
        {
          "name": "mask",
          "type": "int",
          "min": 0,
          "max": 255
        }
      ],
      "query_params": [],
      "returns": null,
      "example": null,
      "locked_while_running": null,
      "category": "common",
      "manual_page": "2-4",
      "notes": null,
      "discrepancies": [],
      "emit_allowed": true,
      "verified_on_hw": false
    },
    {
      "header": "*SRE?",
      "kind": "query",
      "aliases": [],
      "params": [],
      "query_params": [],
      "returns": {
        "type": "int",
        "range": [
          0,
          255
        ]
      },
      "example": null,
      "locked_while_running": null,
      "category": "common",
      "manual_page": "2-4",
      "notes": null,
      "discrepancies": [],
      "emit_allowed": true,
      "verified_on_hw": false
    },
    {
      "header": "*STB?",
      "kind": "query",
      "aliases": [],
      "params": [],
      "query_params": [],
      "returns": {
        "type": "int",
        "range": [
          0,
          255
        ]
      },
      "example": null,
      "locked_while_running": null,
      "category": "common",
      "manual_page": "2-4",
      "notes": null,
      "discrepancies": [],
      "emit_allowed": true,
      "verified_on_hw": false
    },
    {
      "header": "*TST?",
      "kind": "query",
      "aliases": [],
      "params": [],
      "query_params": [],
      "returns": null,
      "example": null,
      "locked_while_running": null,
      "category": "common",
      "manual_page": "1-4",
      "notes": "Listed as not supported.",
      "discrepancies": [],
      "emit_allowed": false,
      "verified_on_hw": false
    },
    {
      "header": "*WAI",
      "kind": "action",
      "aliases": [],
      "params": [],
      "query_params": [],
      "returns": null,
      "example": null,
      "locked_while_running": null,
      "category": "common",
      "manual_page": "2-4",
      "notes": null,
      "discrepancies": [],
      "emit_allowed": true,
      "verified_on_hw": false
    },
    {
      "header": ":SYSTem:ERRor?",
      "kind": "query",
      "aliases": [
        ":SYST:ERR?"
      ],
      "params": [],
      "query_params": [],
      "returns": {
        "type": "string",
        "format": "<code>,\"<text>\"",
        "example": "0,\"No error\""
      },
      "example": null,
      "locked_while_running": null,
      "category": "common",
      "manual_page": "1-4",
      "notes": "Reading removes the entry from the error queue.",
      "discrepancies": [
        "D16"
      ],
      "emit_allowed": true,
      "verified_on_hw": false
    },
    {
      "header": "GPS:?",
      "kind": "query",
      "aliases": [],
      "params": [],
      "query_params": [
        {
          "name": "section",
          "type": "enum",
          "values": [
            "ALL",
            "GEN",
            "CAL",
            "DIAG",
            "FILE",
            "GPSR",
            "ROUTE",
            "SET",
            "SIM",
            "SVPRN",
            "WAYP"
          ]
        }
      ],
      "returns": {
        "type": "string",
        "notes": "List of RCI commands for the section."
      },
      "example": "GPS:? ALL",
      "locked_while_running": null,
      "category": "help",
      "manual_page": "3-1",
      "notes": "Authoritative list of commands accepted by the installed firmware. First thing to capture on hardware.",
      "discrepancies": [],
      "emit_allowed": true,
      "verified_on_hw": false
    },
    {
      "header": "GPS:SYST:CPAS",
      "kind": "set",
      "aliases": [],
      "params": [
        {
          "name": "oldpassword",
          "type": "string",
          "maxlen": 80
        },
        {
          "name": "newpassword",
          "type": "string",
          "maxlen": 80
        }
      ],
      "query_params": [],
      "returns": null,
      "example": null,
      "locked_while_running": null,
      "category": "general",
      "manual_page": "4-1",
      "notes": "Changes system password. Never generated by the twin.",
      "discrepancies": [],
      "emit_allowed": false,
      "verified_on_hw": false
    },
    {
      "header": "GPS:STAT?",
      "kind": "query",
      "aliases": [],
      "params": [],
      "query_params": [],
      "returns": {
        "type": "string",
        "example": "\"Jan 4 22:12:03 2015, System clock set to GPS time\""
      },
      "example": null,
      "locked_while_running": null,
      "category": "general",
      "manual_page": "4-1",
      "notes": "Status bar contents. Used to read results of GPS:ROUT:VALD and GPS:SET:CHAN:APPL.",
      "discrepancies": [],
      "emit_allowed": true,